Microsoft Windows [Version 10.0.19045.3803]
(c) Microsoft Corporation. All rights reserved.

C:\WINDOWS\system32>cd\

C:\>d:

D:\>cd xampp

D:\xampp>cd mysql

D:\xampp\mysql>cd bin

D:\xampp\mysql\bin>mysql -u root -p
Enter password:
Welcome to the MariaDB monitor.  Commands end with ; or \g.
Your MariaDB connection id is 457
Server version: 10.4.27-MariaDB mariadb.org binary distribution

Copyright (c) 2000, 2018, Oracle, MariaDB Corporation Ab and others.

Type 'help;' or '\h' for help. Type '\c' to clear the current input statement.

MariaDB [(none)]> create database farmasi;
Query OK, 1 row affected (1.824 sec)

MariaDB [(none)]> use farmasi;
Database changed
MariaDB [farmasi]> create table obat(
    -> id int primary key auto_increment,
    -> kodeobat varchar(10) unique,
    -> namaobat varchar(100),
    -> beratobat varchar(10),
    -> bentukobat varchar(50));
Query OK, 0 rows affected (1.983 sec)

MariaDB [farmasi]> show tables;
+-------------------+
| Tables_in_farmasi |
+-------------------+
| obat              |
+-------------------+
1 row in set (0.001 sec)

MariaDB [farmasi]> insert into obat(kodeobat,namaobat,beratobat,bentukobat)values('111','paracetamol','20mg','tablet');
Query OK, 1 row affected (1.836 sec)

MariaDB [farmasi]> insert into obat(kodeobat,namaobat,beratobat,bentukobat)values('121','bioplacenton','30g','salep');
Query OK, 1 row affected (0.085 sec)

MariaDB [farmasi]> insert into obat(kodeobat,namaobat,beratobat,bentukobat)values('131','chlorphenamine','15','tablet');
Query OK, 1 row affected (1.786 sec)

MariaDB [farmasi]> insert into obat(kodeobat,namaobat,beratobat,bentukobat)values('141','alerfed','40ml','sirup/cair');
Query OK, 1 row affected (0.170 sec)

MariaDB [farmasi]> insert into obat(kodeobat,namaobat,beratobat,bentukobat)values('151','ciprofloxacin','10ml','tetes');
Query OK, 1 row affected (1.760 sec)

MariaDB [farmasi]> select * from obat;
+----+----------+----------------+-----------+------------+
| id | kodeobat | namaobat       | beratobat | bentukobat |
+----+----------+----------------+-----------+------------+
|  1 | 111      | paracetamol    | 20mg      | tablet     |
|  2 | 121      | bioplacenton   | 30g       | salep      |
|  3 | 131      | chlorphenamine | 15        | tablet     |
|  4 | 141      | alerfed        | 40ml      | sirup/cair |
|  5 | 151      | ciprofloxacin  | 10ml      | tetes      |
+----+----------+----------------+-----------+------------+
5 rows in set (0.001 sec)

MariaDB [farmasi]> update obat set namaobat='hypromellose' where id='5';
Query OK, 1 row affected (1.774 sec)
Rows matched: 1  Changed: 1  Warnings: 0

MariaDB [farmasi]> update obat set beratobat='7ml' where id='5';
Query OK, 1 row affected (1.768 sec)
Rows matched: 1  Changed: 1  Warnings: 0

MariaDB [farmasi]> select * from obat;
+----+----------+----------------+-----------+------------+
| id | kodeobat | namaobat       | beratobat | bentukobat |
+----+----------+----------------+-----------+------------+
|  1 | 111      | paracetamol    | 20mg      | tablet     |
|  2 | 121      | bioplacenton   | 30g       | salep      |
|  3 | 131      | chlorphenamine | 15        | tablet     |
|  4 | 141      | alerfed        | 40ml      | sirup/cair |
|  5 | 151      | hypromellose   | 7ml       | tetes      |
+----+----------+----------------+-----------+------------+
5 rows in set (0.000 sec)

MariaDB [farmasi]> delete from obat where kodeobat='131';
Query OK, 1 row affected (0.395 sec)

MariaDB [farmasi]> select * from obat;
+----+----------+--------------+-----------+------------+
| id | kodeobat | namaobat     | beratobat | bentukobat |
+----+----------+--------------+-----------+------------+
|  1 | 111      | paracetamol  | 20mg      | tablet     |
|  2 | 121      | bioplacenton | 30g       | salep      |
|  4 | 141      | alerfed      | 40ml      | sirup/cair |
|  5 | 151      | hypromellose | 7ml       | tetes      |
+----+----------+--------------+-----------+------------+
4 rows in set (0.001 sec)

MariaDB [farmasi]>